{
  "id": "Malonno_Survivors",
  "game_id": "Malonno_Survivors",
  "title_key": "game_title",
  "version": "1.30",
  "menu": {
    "background": "assets/Creazione_Video_Hidden_Object_Malonno_Hill.mp4",
    "music": [
      "audio/music/Indecenti - Backspace.mp3"
    ]
  },
  "levels": [
    "Welcome_To_Malonno"
  ],
  "ui_theme": "mystery",
  "category": "desktop"
}